cve_id,description,published_date,references
CVE-2011-3079,"The Inter-process Communication (IPC) implementation in Google Chrome before 18.0.1025.168, as used in Mozilla Firefox before 38.0 and other products, does not properly validate messages, which has unspecified impact and attack vectors.",2012-05-01,"http://googlechromereleases.blogspot.com/2012/04/stable-channel-update_30.html,http://www.debian.org/security/2015/dsa-3260,http://www.mozilla.org/security/announce/2015/mfsa2015-57.html,http://www.securityfocus.com/bid/53309,http://osvdb.org/81645,https://bugzilla.mozilla.org/show_bug.cgi?id=1087565,https://exchange.xforce.ibmcloud.com/vulnerabilities/75271,http://lists.opensuse.org/opensuse-security-announce/2015-05/msg00012.html,http://code.google.com/p/chromium/issues/detail?id=117627,http://lists.opensuse.org/opensuse-updates/2015-05/msg00036.html,http://lists.opensuse.org/opensuse-security-announce/2015-07/msg00031.html,http://www.securitytracker.com/id?1027001,http://rhn.redhat.com/errata/RHSA-2015-1012.html,http://secunia.com/advisories/48992,https://www.mozilla.org/en-US/security/known-vulnerabilities/thunderbird/#thunderbird31.7"
CVE-2014-1568,"Mozilla Network Security Services (NSS) before 3.16.2.1, 3.16.x before 3.16.5, and 3.17.x before 3.17.1, as used in Mozilla Firefox before 32.0.3, Mozilla Firefox ESR 24.x before 24.8.1 and 31.x before 31.1.1, Mozilla Thunderbird before 24.8.1 and 31.x before 31.1.2, Mozilla SeaMonkey before 2.29.1, Google Chrome before 37.0.2062.124 on Windows and OS X, and Google Chrome OS before 37.0.2062.120, does not properly parse ASN.1 values in X.509 certificates, which makes it easier for remote attackers to spoof RSA signatures via a crafted certificate, aka a ""signature malleability"" issue.",2014-09-25,"http://www.ubuntu.com/usn/USN-2360-1,http://secunia.com/advisories/61575,http://www.novell.com/support/kb/doc.php?id=7015701,http://lists.opensuse.org/opensuse-security-announce/2014-09/msg00039.html,http://secunia.com/advisories/61574,http://www.debian.org/security/2014/dsa-3033,http://www.oracle.com/technetwork/topics/security/cpuapr2015-2365600.html,http://googlechromereleases.blogspot.com/2014/09/stable-channel-update-for-chrome-os_24.html,http://www.oracle.com/technetwork/topics/security/cpujan2015-1972971.html,https://bugzilla.mozilla.org/show_bug.cgi?id=1069405,https://security.gentoo.org/glsa/201504-01,http://lists.opensuse.org/opensuse-security-announce/2014-09/msg00036.html,http://kb.juniper.net/InfoCenter/index?page=content&id=JSA10698,http://www.oracle.com/technetwork/topics/security/cpujul2015-2367936.html,http://www.ubuntu.com/usn/USN-2360-2,http://googlechromereleases.blogspot.com/2014/09/stable-channel-update_24.html,https://exchange.xforce.ibmcloud.com/vulnerabilities/96194,http://kb.juniper.net/InfoCenter/index?page=content&id=JSA10761,http://www.kb.cert.org/vuls/id/772676,http://rhn.redhat.com/errata/RHSA-2014-1371.html,http://www.debian.org/security/2014/dsa-3037,http://www.securityfocus.com/bid/70116,http://www.ubuntu.com/usn/USN-2361-1,http://secunia.com/advisories/61583,http://lists.opensuse.org/opensuse-security-announce/2014-09/msg00032.html,http://www.oracle.com/technetwork/topics/security/ovmbulletinjul2016-3090546.html,http://www.oracle.com/technetwork/topics/security/bulletinapr2016-2952098.html,http://www.debian.org/security/2014/dsa-3034,http://secunia.com/advisories/61540,https://bugzilla.mozilla.org/show_bug.cgi?id=1064636,http://www.mozilla.org/security/announce/2014/mfsa2014-73.html,http://rhn.redhat.com/errata/RHSA-2014-1307.html,http://secunia.com/advisories/61576,http://rhn.redhat.com/errata/RHSA-2014-1354.html"
CVE-2002-2436,"The Cascading Style Sheets (CSS) implementation in Mozilla Firefox before 4.0, Thunderbird before 3.3, and SeaMonkey before 2.1 does not properly handle the :visited pseudo-class, which allows remote attackers to obtain sensitive information about visited web pages via a crafted HTML document, a related issue to CVE-2010-2264.",2011-12-07,"https://exchange.xforce.ibmcloud.com/vulnerabilities/71816,http://bugzilla.mozilla.org/show_bug.cgi?id=147777,http://w2spconf.com/2010/papers/p26.pdf,http://blog.mozilla.com/security/2010/03/31/plugging-the-css-history-leak/,https://developer.mozilla.org/en/CSS/Privacy_and_the_:visited_selector"
CVE-2002-2437,"The JavaScript implementation in Mozilla Firefox before 4.0, Thunderbird before 3.3, and SeaMonkey before 2.1 does not properly restrict the set of values contained in the object returned by the getComputedStyle method, which allows remote attackers to obtain sensitive information about visited web pages by calling this method.",2011-12-07,"http://bugzilla.mozilla.org/show_bug.cgi?id=147777,http://w2spconf.com/2010/papers/p26.pdf,https://developer.mozilla.org/en/CSS/Privacy_and_the_:visited_selector,http://blog.mozilla.com/security/2010/03/31/plugging-the-css-history-leak/"
CVE-2004-0648,"Mozilla (Suite) before 1.7.1, Firefox before 0.9.2, and Thunderbird before 0.7.2 allow remote attackers to launch arbitrary programs via a URI referencing the shell: protocol.",2004-08-06,"http://marc.info/?l=bugtraq&m=108938712815719&w=2,http://www.ciac.org/ciac/bulletins/o-175.shtml,http://www.mozilla.org/projects/security/known-vulnerabilities.html,http://lists.grok.org.uk/pipermail/full-disclosure/2004-July/023573.html,http://www.kb.cert.org/vuls/id/927014,https://exchange.xforce.ibmcloud.com/vulnerabilities/16655,http://www.mozilla.org/security/shell.html"
CVE-2004-0757,"Heap-based buffer overflow in the SendUidl in the POP3 capability for Mozilla before 1.7, Firefox before 0.9, and Thunderbird before 0.7, may allow remote POP3 mail servers to execute arbitrary code.",2004-08-18,"http://www.redhat.com/support/errata/RHSA-2004-421.html,https://exchange.xforce.ibmcloud.com/vulnerabilities/16869,http://bugzilla.mozilla.org/show_bug.cgi?id=229374,http://www.securityfocus.com/bid/15495,http://www.mozilla.org/projects/security/known-vulnerabilities.html#mozilla1.7,http://www.novell.com/linux/security/advisories/2004_36_mozilla.html,ftp://ftp.sco.com/pub/updates/OpenServer/SCOSA-2005.49/SCOSA-2005.49.txt,http://marc.info/?l=bugtraq&m=109900315219363&w=2,http://www.kb.cert.org/vuls/id/561022"
CVE-2004-0761,"Mozilla before 1.7, Firefox before 0.9, and Thunderbird before 0.7, allow remote attackers to use certain redirect sequences to spoof the security lock icon that makes a web page appear to be encrypted.",2004-08-18,"http://www.redhat.com/support/errata/RHSA-2004-421.html,http://bugzilla.mozilla.org/show_bug.cgi?id=240053,http://www.securityfocus.com/bid/15495,http://www.novell.com/linux/security/advisories/2004_36_mozilla.html,http://www.mozilla.org/projects/security/known-vulnerabilities.html#mozilla1.7,ftp://ftp.sco.com/pub/updates/OpenServer/SCOSA-2005.49/SCOSA-2005.49.txt,https://exchange.xforce.ibmcloud.com/vulnerabilities/16871,http://marc.info/?l=bugtraq&m=109900315219363&w=2"
CVE-2004-0762,"Mozilla before 1.7, Firefox before 0.9, and Thunderbird before 0.7, allow remote web sites to install arbitrary extensions by using interactive events to manipulate the XPInstall Security dialog box.",2004-08-18,"http://www.redhat.com/support/errata/RHSA-2004-421.html,http://archives.neohapsis.com/archives/fulldisclosure/2004-07/0264.html,https://exchange.xforce.ibmcloud.com/vulnerabilities/16623,http://www.squarefree.com/2004/07/01/race-conditions-in-security-dialogs/,http://www.securityfocus.com/bid/15495,http://www.mozilla.org/projects/security/known-vulnerabilities.html#mozilla1.7,http://bugzilla.mozilla.org/show_bug.cgi?id=162020,http://www.novell.com/linux/security/advisories/2004_36_mozilla.html,ftp://ftp.sco.com/pub/updates/OpenServer/SCOSA-2005.49/SCOSA-2005.49.txt,http://marc.info/?l=bugtraq&m=109900315219363&w=2"
CVE-2004-0764,"Mozilla before 1.7, Firefox before 0.9, and Thunderbird before 0.7, allow remote web sites to hijack the user interface via the ""chrome"" flag and XML User Interface Language (XUL) files.",2004-08-18,"http://www.redhat.com/support/errata/RHSA-2004-421.html,http://www.securityfocus.com/bid/10832,https://exchange.xforce.ibmcloud.com/vulnerabilities/16837,http://bugzilla.mozilla.org/show_bug.cgi?id=244965,http://www.kb.cert.org/vuls/id/262350,http://www.mozilla.org/projects/security/known-vulnerabilities.html#mozilla1.7,http://www.novell.com/linux/security/advisories/2004_36_mozilla.html,http://www.securityfocus.com/bid/15495,ftp://ftp.sco.com/pub/updates/OpenServer/SCOSA-2005.49/SCOSA-2005.49.txt,http://marc.info/?l=bugtraq&m=109900315219363&w=2"
CVE-2004-0765,"The cert_TestHostName function in Mozilla before 1.7, Firefox before 0.9, and Thunderbird before 0.7, only checks the hostname portion of a certificate when the hostname portion of the URI is not a fully qualified domain name (FQDN), which allows remote attackers to spoof trusted certificates.",2004-08-18,"http://www.redhat.com/support/errata/RHSA-2004-421.html,http://bugzilla.mozilla.org/show_bug.cgi?id=234058,https://exchange.xforce.ibmcloud.com/vulnerabilities/16868,http://www.novell.com/linux/security/advisories/2004_36_mozilla.html,http://www.mozilla.org/projects/security/known-vulnerabilities.html#mozilla1.7,http://marc.info/?l=bugtraq&m=109900315219363&w=2"
CVE-2004-0902,"Multiple heap-based buffer overflows in Mozilla Firefox before the Preview Release, Mozilla before 1.7.3, and Thunderbird before 0.8 allow remote attackers to cause a denial of service (application crash) or execute arbitrary code via (1) the ""Send page"" functionality, (2) certain responses from a malicious POP3 server, or (3) a link containing a non-ASCII hostname.",2005-01-27,"http://xforce.iss.net/xforce/xfdb/17379,http://marc.theaimsgroup.com/?l=bugtraq&m=109698896104418&w=2,http://www.novell.com/linux/security/advisories/2004_36_mozilla.html,http://security.gentoo.org/glsa/glsa-200409-26.xml,http://www.us-cert.gov/cas/techalerts/TA04-261A.html,http://marc.theaimsgroup.com/?l=bugtraq&m=109900315219363&w=2,http://www.mozilla.org/projects/security/known-vulnerabilities.html#mozilla1.7.3,http://xforce.iss.net/xforce/xfdb/17378,http://bugzilla.mozilla.org/show_bug.cgi?id=245066,http://bugzilla.mozilla.org/show_bug.cgi?id=226669,http://bugzilla.mozilla.org/show_bug.cgi?id=258005,http://bugzilla.mozilla.org/show_bug.cgi?id=256316"
CVE-2004-0903,"Stack-based buffer overflow in the writeGroup function in nsVCardObj.cpp for Mozilla Firefox before the Preview Release, Mozilla before 1.7.3, and Thunderbird before 0.8 allows remote attackers to execute arbitrary code via malformed VCard attachments that are not properly handled when previewing a message.",2005-01-27,"http://xforce.iss.net/xforce/xfdb/17380,http://www.securityfocus.com/bid/11174,http://marc.theaimsgroup.com/?l=bugtraq&m=109698896104418&w=2,http://www.novell.com/linux/security/advisories/2004_36_mozilla.html,http://security.gentoo.org/glsa/glsa-200409-26.xml,http://www.kb.cert.org/vuls/id/414240,http://www.us-cert.gov/cas/techalerts/TA04-261A.html,http://marc.theaimsgroup.com/?l=bugtraq&m=109900315219363&w=2,http://www.mozilla.org/projects/security/known-vulnerabilities.html#mozilla1.7.3,http://bugzilla.mozilla.org/show_bug.cgi?id=257314"
CVE-2004-0904,"Integer overflow in the bitmap (BMP) decoder for Mozilla Firefox before the Preview Release, Mozilla before 1.7.3, and Thunderbird before 0.8 allow remote attackers to execute arbitrary code via wide bitmap files that trigger heap-based buffer overflows.",2004-12-31,"http://bugzilla.mozilla.org/show_bug.cgi?id=255067,http://www.mozilla.org/projects/security/known-vulnerabilities.html#mozilla1.7.3,http://security.gentoo.org/glsa/glsa-200409-26.xml,http://www.securityfocus.com/bid/11171,http://www.us-cert.gov/cas/techalerts/TA04-261A.html,http://marc.info/?l=bugtraq&m=109698896104418&w=2,http://www.kb.cert.org/vuls/id/847200,https://exchange.xforce.ibmcloud.com/vulnerabilities/17381,http://www.novell.com/linux/security/advisories/2004_36_mozilla.html,http://marc.info/?l=bugtraq&m=109900315219363&w=2"
CVE-2004-0906,"The XPInstall installer in Mozilla Firefox before the Preview Release, Mozilla before 1.7.3, and Thunderbird before 0.8 sets insecure permissions for certain installed files within xpi packages, which could allow local users to overwrite arbitrary files or execute arbitrary code.",2004-12-31,"http://www.securityfocus.com/bid/11192,http://www.novell.com/linux/security/advisories/2004_36_mozilla.html,http://xforce.iss.net/xforce/xfdb/17375,http://security.gentoo.org/glsa/glsa-200409-26.xml,http://www.redhat.com/support/errata/RHSA-2005-323.html,http://www.kb.cert.org/vuls/id/653160,http://www.mozilla.org/projects/security/known-vulnerabilities.html#mozilla1.7.3,http://bugzilla.mozilla.org/show_bug.cgi?id=235781,http://bugzilla.mozilla.org/show_bug.cgi?id=231083"
CVE-2004-0907,"The Linux install .tar.gz archives for Mozilla Firefox before the Preview Release, Mozilla before 1.7.3, and Thunderbird before 0.8, create certain files with insecure permissions, which could allow local users to overwrite those files and execute arbitrary code.",2004-12-31,"http://security.gentoo.org/glsa/glsa-200409-26.xml,http://www.mozilla.org/projects/security/known-vulnerabilities.html#mozilla1.7.3,http://xforce.iss.net/xforce/xfdb/17373,http://bugzilla.mozilla.org/show_bug.cgi?id=254303"
CVE-2004-0908,"Mozilla Firefox before the Preview Release, Mozilla before 1.7.3, and Thunderbird before 0.8 allows untrusted Javascript code to read and write to the clipboard, and possibly obtain sensitive information, via script-generated events such as Ctrl-Ins.",2004-12-31,"http://marc.theaimsgroup.com/?l=bugtraq&m=109698896104418&w=2,http://www.novell.com/linux/security/advisories/2004_36_mozilla.html,http://security.gentoo.org/glsa/glsa-200409-26.xml,http://xforce.iss.net/xforce/xfdb/17376,http://www.securityfocus.com/bid/11179,http://www.kb.cert.org/vuls/id/460528,http://marc.theaimsgroup.com/?l=bugtraq&m=109900315219363&w=2,http://www.mozilla.org/projects/security/known-vulnerabilities.html#mozilla1.7.3,http://bugzilla.mozilla.org/show_bug.cgi?id=257523"
CVE-2004-0909,"Mozilla Firefox before the Preview Release, Mozilla before 1.7.3, and Thunderbird before 0.8 may allow remote attackers to trick users into performing unexpected actions, including installing software, via signed scripts that request enhanced abilities using the enablePrivilege parameter, then modify the meaning of certain security-relevant dialog messages.",2004-12-31,"http://marc.theaimsgroup.com/?l=bugtraq&m=109698896104418&w=2,http://www.novell.com/linux/security/advisories/2004_36_mozilla.html,http://security.gentoo.org/glsa/glsa-200409-26.xml,http://xforce.iss.net/xforce/xfdb/17377,http://www.mozilla.org/projects/security/known-vulnerabilities.html#mozilla1.7.3,http://www.kb.cert.org/vuls/id/113192,http://bugzilla.mozilla.org/show_bug.cgi?id=253942"
CVE-2004-1449,"Mozilla before 1.7, Firefox before 0.9, and Thunderbird before 0.7 allows remote attackers to determine the location of files on a user's hard drive by obscuring a file upload control and tricking the user into dragging text into that control.",2004-12-31,http://bugzilla.mozilla.org/show_bug.cgi?id=206859#c0
CVE-2004-2226,"Mozilla Mail 1.7.1 and 1.7.3, and Thunderbird before 0.9, when HTML-Mails is enabled, allows remote attackers to determine valid e-mail addresses via an HTML e-mail that references a Cascading Style Sheets (CSS) document on the attacker's server.",2004-12-31,"http://archives.neohapsis.com/archives/fulldisclosure/2004-11/0070.html,http://xforce.iss.net/xforce/xfdb/17949"
CVE-2005-0142,"Firefox 0.9, Thunderbird 0.6 and other versions before 0.9, and Mozilla 1.7 before 1.7.5 save temporary files with world-readable permissions, which allows local users to read certain web content or attachments that belong to other users, e.g. content that is managed by helper applications such as PDF.",2005-05-02,"http://www.mozilla.org/security/announce/mfsa2005-02.html,https://bugzilla.mozilla.org/show_bug.cgi?id=251297,http://www.novell.com/linux/security/advisories/2006_04_25.html,https://exchange.xforce.ibmcloud.com/vulnerabilities/17832,http://www.redhat.com/support/errata/RHSA-2005-384.html,http://www.redhat.com/support/errata/RHSA-2005-335.html"
CVE-2005-0148,"Thunderbird before 0.9, when running on Windows systems, uses the default handler when processing javascript: links, which invokes Internet Explorer and may expose the Thunderbird user to vulnerabilities in the version of Internet Explorer that is installed on the user's system.  NOTE: since the invocation between multiple products is a common practice, and the vulnerabilities inherent in multi-product interactions are not easily enumerable, this issue might be REJECTED in the future.",2005-05-02,"http://www.mozilla.org/security/announce/mfsa2005-10.html,http://xforce.iss.net/xforce/xfdb/19173,http://www.securityfocus.com/bid/12407,https://bugzilla.mozilla.org/show_bug.cgi?id=263546"
CVE-2005-0149,"Thunderbird 0.6 through 0.9 and Mozilla 1.7 through 1.7.3 does not obey the network.cookie.disableCookieForMailNews preference, which could allow remote attackers bypass the user's intended privacy and security policy by using cookies in e-mail messages.",2005-02-15,"http://www.redhat.com/support/errata/RHSA-2005-323.html,http://www.novell.com/linux/security/advisories/2006_04_25.html,http://www.securityfocus.com/bid/12407,http://xforce.iss.net/xforce/xfdb/19172,http://www.mozilla.org/security/announce/mfsa2005-11.html,http://www.redhat.com/support/errata/RHSA-2005-094.html,http://www.redhat.com/support/errata/RHSA-2005-335.html,https://bugzilla.mozilla.org/show_bug.cgi?id=268107"
CVE-2005-0255,"String handling functions in Mozilla 1.7.3, Firefox 1.0, and Thunderbird before 1.0.2, such as the nsTSubstring_CharT::Replace function, do not properly check the return values of other functions that resize the string, which allows remote attackers to cause a denial of service and possibly execute arbitrary code by forcing an out-of-memory state that causes a reallocation to fail and return a pointer to a fixed address, which leads to heap corruption.",2005-05-02,"http://www.redhat.com/support/errata/RHSA-2005-277.html,http://www.mozilla.org/security/announce/mfsa2005-18.html,http://www.redhat.com/support/errata/RHSA-2005-337.html,http://www.idefense.com/application/poi/display?id=200&type=vulnerabilities,http://www.novell.com/linux/security/advisories/2005_16_mozilla_firefox.html,http://www.gentoo.org/security/en/glsa/glsa-200503-30.xml,http://www.novell.com/linux/security/advisories/2006_04_25.html,http://www.redhat.com/support/errata/RHSA-2005-176.html,http://www.securityfocus.com/bid/12659,http://www.gentoo.org/security/en/glsa/glsa-200503-10.xml"
CVE-2005-0399,"Heap-based buffer overflow in GIF2.cpp in Firefox before 1.0.2, Mozilla before to 1.7.6, and Thunderbird before 1.0.2, and possibly other applications that use the same library, allows remote attackers to execute arbitrary code via a GIF image with a crafted Netscape extension 2 block and buffer size.",2005-05-02,"http://www.mozilla.org/security/announce/mfsa2005-30.html,http://www.securityfocus.com/bid/12881,http://xforce.iss.net/xforce/alerts/id/191,https://bugzilla.redhat.com/bugzilla/show_bug.cgi?id=150877,http://www.ciac.org/ciac/bulletins/p-160.shtml,http://www.vupen.com/english/advisories/2005/0296,http://www.redhat.com/support/errata/RHSA-2005-337.html,http://www.redhat.com/support/errata/RHSA-2005-323.html,http://www.kb.cert.org/vuls/id/557948,http://www.redhat.com/support/errata/RHSA-2005-336.html,http://www.gentoo.org/security/en/glsa/glsa-200503-30.xml,http://www.novell.com/linux/security/advisories/2006_04_25.html,http://www.securityfocus.com/bid/15495,https://exchange.xforce.ibmcloud.com/vulnerabilities/19269,ftp://ftp.sco.com/pub/updates/OpenServer/SCOSA-2005.49/SCOSA-2005.49.txt,http://www.redhat.com/support/errata/RHSA-2005-335.html"
CVE-2005-0590,"The installation confirmation dialog in Firefox before 1.0.1, Thunderbird before 1.0.1, and Mozilla before 1.7.6 allows remote attackers to use InstallTrigger to spoof the hostname of the host performing the installation via a long ""user:pass"" sequence in the URL, which appears before the real hostname.",2005-05-02,"http://www.mozilla.org/security/announce/mfsa2005-17.html,https://bugzilla.mozilla.org/show_bug.cgi?id=268059,http://www.gentoo.org/security/en/glsa/glsa-200503-30.xml,http://www.novell.com/linux/security/advisories/2006_04_25.html,http://www.redhat.com/support/errata/RHSA-2005-176.html,http://www.securityfocus.com/bid/12659,http://www.redhat.com/support/errata/RHSA-2005-384.html,http://www.gentoo.org/security/en/glsa/glsa-200503-10.xml"
CVE-2005-2261,"Firefox before 1.0.5, Thunderbird before 1.0.5, Mozilla before 1.7.9, Netscape 8.0.2, and K-Meleon 0.9 runs XBL scripts even when Javascript has been disabled, which makes it easier for remote attackers to bypass such protection.",2005-07-13,"http://www.networksecurity.fi/advisories/netscape-multiple-issues.html,https://bugzilla.mozilla.org/show_bug.cgi?id=292589,http://www.mozilla.org/security/announce/mfsa2005-46.html,http://www.novell.com/linux/security/advisories/2005_18_sr.html,http://www.redhat.com/support/errata/RHSA-2005-587.html,http://www.ciac.org/ciac/bulletins/p-252.shtml,http://www.debian.org/security/2005/dsa-810,http://www.vupen.com/english/advisories/2005/1075,http://www.redhat.com/support/errata/RHSA-2005-601.html,http://www.novell.com/linux/security/advisories/2005_45_mozilla.html,http://www.novell.com/linux/security/advisories/2006_04_25.html,https://bugzilla.mozilla.org/show_bug.cgi?id=292591,http://www.redhat.com/support/errata/RHSA-2005-586.html,https://bugzilla.redhat.com/bugzilla/show_bug.cgi?id=160202,http://www.securityfocus.com/bid/14242"
CVE-2005-2353,"run-mozilla.sh in Thunderbird, with debugging enabled, allows local users to create or overwrite arbitrary files via a symlink attack on temporary files.",2005-08-05,"http://www.debian.org/security/2006/dsa-1051,http://www.securityfocus.com/bid/14443,http://www.debian.org/security/2006/dsa-1046,http://www.ubuntulinux.org/support/documentation/usn/usn-157-1,http://www.mandriva.com/security/advisories?name=MDKSA-2005:173,http://www.mandriva.com/security/advisories?name=MDKSA-2005:174"
CVE-2005-2602,"Mozilla Thunderbird 1.0 and Firefox 1.0.6 allows remote attackers to obfuscate URIs via a long URI, which causes the address bar to go blank and could facilitate phishing attacks.",2005-08-17,"http://www.scip.ch/cgi-bin/smss/showadvf.pl?id=1682,http://www.securityfocus.com/bid/14526,http://www.securityfocus.com/archive/1/407704"
CVE-2005-3402,"The SMTP client in Mozilla Thunderbird 1.0.5 BETA, 1.0.7, and possibly other versions, does not notify users when it cannot establish a secure channel with the server, which allows remote attackers to obtain authentication information without detection via a man-in-the-middle (MITM) attack that bypasses TLS authentication or downgrades CRAM-MD5 authentication to plain authentication.",2005-11-01,"http://marc.theaimsgroup.com/?l=bugtraq&m=113034421329653&w=2,http://marc.theaimsgroup.com/?l=bugtraq&m=113028017608146&w=2,http://www.securityfocus.com/bid/15106,https://bugzilla.mozilla.org/show_bug.cgi?id=311657"
CVE-2005-4809,"Mozilla Firefox 1.0.1 and possibly other versions, including Mozilla and Thunderbird, allows remote attackers to spoof the URL in the Status Bar via an A HREF tag that contains a TABLE tag that contains another A tag.",2005-12-31,"http://securitytracker.com/id?1013423,http://www.vupen.com/english/advisories/2005/0260,https://exchange.xforce.ibmcloud.com/vulnerabilities/19540,http://www.securityfocus.com/bid/12798,http://marc.info/?l=full-disclosure&m=111073068631287&w=2"
CVE-2006-0236,"GUI display truncation vulnerability in Mozilla Thunderbird 1.0.2, 1.0.6, and 1.0.7 allows user-assisted attackers to execute arbitrary code via an attachment with a filename containing a large number of spaces ending with a dangerous extension that is not displayed by Thunderbird, along with an inconsistent Content-Type header, which could be used to trick a user into downloading dangerous content by dragging or saving the attachment.",2006-01-17,"http://www.vupen.com/english/advisories/2006/0230,http://www.securityfocus.com/bid/16271,http://www.mandriva.com/security/advisories?name=MDKSA-2006:021,http://xforce.iss.net/xforce/xfdb/24164,http://www.securityfocus.com/archive/1/archive/1/422148/100/0/threaded,https://bugzilla.mozilla.org/show_bug.cgi?id=300246"
CVE-2006-0294,"Mozilla Firefox before 1.5.0.1, Thunderbird 1.5 if running Javascript in mail, and SeaMonkey before 1.0 allow remote attackers to execute arbitrary code by changing an element's style from position:relative to position:static, which causes Gecko to operate on freed memory.",2006-02-02,"http://www.vupen.com/english/advisories/2006/3749,http://www.vupen.com/english/advisories/2006/0413,http://www.mozilla.org/security/announce/2006/mfsa2006-02.html,http://securitytracker.com/id?1015570,https://bugzilla.mozilla.org/show_bug.cgi?id=317934,http://www.securityfocus.com/bid/16476,https://exchange.xforce.ibmcloud.com/vulnerabilities/24431,http://www.securityfocus.com/archive/1/archive/1/446657/100/200/threaded"
