cve_id,description,published_date,references
CVE-2013-0773,"The Chrome Object Wrapper (COW) and System Only Wrapper (SOW) implementations in Mozilla Firefox before 19.0, Firefox ESR 17.x before 17.0.3, Thunderbird before 17.0.3, Thunderbird ESR 17.x before 17.0.3, and SeaMonkey before 2.16 do not prevent modifications to a prototype, which allows remote attackers to obtain sensitive information from chrome objects or possibly execute arbitrary JavaScript code with chrome privileges via a crafted web site.",2013-02-19,"http://www.debian.org/security/2013/dsa-2699,http://www.ubuntu.com/usn/USN-1748-1,https://bugzilla.mozilla.org/show_bug.cgi?id=809652,http://www.ubuntu.com/usn/USN-1729-1,http://lists.opensuse.org/opensuse-security-announce/2013-02/msg00017.html,http://www.ubuntu.com/usn/USN-1729-2,http://www.mozilla.org/security/announce/2013/mfsa2013-24.html,http://lists.opensuse.org/opensuse-updates/2013-02/msg00062.html"
CVE-2013-0774,"Mozilla Firefox before 19.0, Firefox ESR 17.x before 17.0.3, Thunderbird before 17.0.3, Thunderbird ESR 17.x before 17.0.3, and SeaMonkey before 2.16 do not prevent JavaScript workers from reading the browser-profile directory name, which has unspecified impact and remote attack vectors.",2013-02-19,"https://bugzilla.mozilla.org/show_bug.cgi?id=827193,http://www.ubuntu.com/usn/USN-1748-1,http://www.ubuntu.com/usn/USN-1729-1,http://www.mozilla.org/security/announce/2013/mfsa2013-25.html,http://lists.opensuse.org/opensuse-security-announce/2013-02/msg00017.html,http://www.ubuntu.com/usn/USN-1729-2,http://lists.opensuse.org/opensuse-updates/2013-02/msg00062.html"
CVE-2013-0775,"Use-after-free vulnerability in the nsImageLoadingContent::OnStopContainer function in Mozilla Firefox before 19.0, Firefox ESR 17.x before 17.0.3, Thunderbird before 17.0.3, Thunderbird ESR 17.x before 17.0.3, and SeaMonkey before 2.16 allows remote attackers to execute arbitrary code via crafted web script.",2013-02-19,"http://www.debian.org/security/2013/dsa-2699,http://rhn.redhat.com/errata/RHSA-2013-0272.html,http://www.ubuntu.com/usn/USN-1748-1,http://www.ubuntu.com/usn/USN-1729-1,http://rhn.redhat.com/errata/RHSA-2013-0271.html,http://www.mozilla.org/security/announce/2013/mfsa2013-26.html,https://bugzilla.mozilla.org/show_bug.cgi?id=831095,http://lists.opensuse.org/opensuse-security-announce/2013-02/msg00017.html,http://www.ubuntu.com/usn/USN-1729-2,http://lists.opensuse.org/opensuse-updates/2013-02/msg00062.html"
CVE-2013-0776,"Mozilla Firefox before 19.0, Firefox ESR 17.x before 17.0.3, Thunderbird before 17.0.3, Thunderbird ESR 17.x before 17.0.3, and SeaMonkey before 2.16 allow man-in-the-middle attackers to spoof the address bar by operating a proxy server that provides a 407 HTTP status code accompanied by web script, as demonstrated by a phishing attack on an HTTPS site.",2013-02-19,"http://www.debian.org/security/2013/dsa-2699,http://rhn.redhat.com/errata/RHSA-2013-0272.html,http://www.ubuntu.com/usn/USN-1748-1,http://www.mozilla.org/security/announce/2013/mfsa2013-27.html,http://www.ubuntu.com/usn/USN-1729-1,http://rhn.redhat.com/errata/RHSA-2013-0271.html,https://bugzilla.mozilla.org/show_bug.cgi?id=796475,http://lists.opensuse.org/opensuse-security-announce/2013-02/msg00017.html,http://www.ubuntu.com/usn/USN-1729-2,http://lists.opensuse.org/opensuse-updates/2013-02/msg00062.html"
CVE-2013-0777,"Use-after-free vulnerability in the nsDisplayBoxShadowOuter::Paint function in Mozilla Firefox before 19.0, Thunderbird before 17.0.3, and SeaMonkey before 2.16 allows remote attackers to execute arbitrary code or cause a denial of service (heap memory corruption) via unspecified vectors.",2013-02-19,"http://www.ubuntu.com/usn/USN-1748-1,http://www.ubuntu.com/usn/USN-1729-1,http://lists.opensuse.org/opensuse-security-announce/2013-02/msg00017.html,http://www.ubuntu.com/usn/USN-1729-2,http://www.mozilla.org/security/announce/2013/mfsa2013-28.html,http://lists.opensuse.org/opensuse-updates/2013-02/msg00062.html,https://bugzilla.mozilla.org/show_bug.cgi?id=798691"
CVE-2013-0778,"The ClusterIterator::NextCluster function in Mozilla Firefox before 19.0, Thunderbird before 17.0.3, and SeaMonkey before 2.16 allows remote attackers to execute arbitrary code or cause a denial of service (out-of-bounds read) via unspecified vectors.",2013-02-19,"https://bugzilla.mozilla.org/show_bug.cgi?id=798867,http://www.ubuntu.com/usn/USN-1748-1,http://www.ubuntu.com/usn/USN-1729-1,http://lists.opensuse.org/opensuse-security-announce/2013-02/msg00017.html,http://www.ubuntu.com/usn/USN-1729-2,http://www.mozilla.org/security/announce/2013/mfsa2013-28.html,http://lists.opensuse.org/opensuse-updates/2013-02/msg00062.html"
CVE-2013-0779,"The nsCodingStateMachine::NextState function in Mozilla Firefox before 19.0, Thunderbird before 17.0.3, and SeaMonkey before 2.16 allows remote attackers to execute arbitrary code or cause a denial of service (out-of-bounds read) via unspecified vectors.",2013-02-19,"http://www.ubuntu.com/usn/USN-1748-1,https://bugzilla.mozilla.org/show_bug.cgi?id=801330,http://www.ubuntu.com/usn/USN-1729-1,http://lists.opensuse.org/opensuse-security-announce/2013-02/msg00017.html,http://www.ubuntu.com/usn/USN-1729-2,http://www.mozilla.org/security/announce/2013/mfsa2013-28.html,http://lists.opensuse.org/opensuse-updates/2013-02/msg00062.html"
CVE-2013-0780,"Use-after-free vulnerability in the nsOverflowContinuationTracker::Finish function in Mozilla Firefox before 19.0, Firefox ESR 17.x before 17.0.3, Thunderbird before 17.0.3, Thunderbird ESR 17.x before 17.0.3, and SeaMonkey before 2.16 allows remote attackers to execute arbitrary code or cause a denial of service (heap memory corruption) via a crafted document that uses Cascading Style Sheets (CSS) -moz-column-* properties.",2013-02-19,"http://www.debian.org/security/2013/dsa-2699,http://rhn.redhat.com/errata/RHSA-2013-0272.html,http://www.ubuntu.com/usn/USN-1748-1,http://www.ubuntu.com/usn/USN-1729-1,http://rhn.redhat.com/errata/RHSA-2013-0271.html,http://lists.opensuse.org/opensuse-security-announce/2013-02/msg00017.html,http://www.ubuntu.com/usn/USN-1729-2,http://www.mozilla.org/security/announce/2013/mfsa2013-28.html,http://lists.opensuse.org/opensuse-updates/2013-02/msg00062.html,https://bugzilla.mozilla.org/show_bug.cgi?id=812893"
CVE-2013-0781,"Use-after-free vulnerability in the nsPrintEngine::CommonPrint function in Mozilla Firefox before 19.0, Thunderbird before 17.0.3, and SeaMonkey before 2.16 allows remote attackers to execute arbitrary code or cause a denial of service (heap memory corruption) via unspecified vectors.",2013-02-19,"http://www.ubuntu.com/usn/USN-1748-1,http://www.ubuntu.com/usn/USN-1729-1,https://bugzilla.mozilla.org/show_bug.cgi?id=821991,http://lists.opensuse.org/opensuse-security-announce/2013-02/msg00017.html,http://www.ubuntu.com/usn/USN-1729-2,http://www.mozilla.org/security/announce/2013/mfsa2013-28.html,http://lists.opensuse.org/opensuse-updates/2013-02/msg00062.html"
CVE-2013-0782,"Heap-based buffer overflow in the nsSaveAsCharset::DoCharsetConversion function in Mozilla Firefox before 19.0, Firefox ESR 17.x before 17.0.3, Thunderbird before 17.0.3, Thunderbird ESR 17.x before 17.0.3, and SeaMonkey before 2.16 allows remote attackers to execute arbitrary code via unspecified vectors.",2013-02-19,"http://www.debian.org/security/2013/dsa-2699,http://rhn.redhat.com/errata/RHSA-2013-0272.html,https://bugzilla.mozilla.org/show_bug.cgi?id=827070,http://www.ubuntu.com/usn/USN-1748-1,http://www.ubuntu.com/usn/USN-1729-1,http://rhn.redhat.com/errata/RHSA-2013-0271.html,http://lists.opensuse.org/opensuse-security-announce/2013-02/msg00017.html,http://www.ubuntu.com/usn/USN-1729-2,http://www.mozilla.org/security/announce/2013/mfsa2013-28.html,http://lists.opensuse.org/opensuse-updates/2013-02/msg00062.html"
CVE-2013-0783,"Multiple unspecified vulnerabilities in the browser engine in Mozilla Firefox before 19.0, Firefox ESR 17.x before 17.0.3, Thunderbird before 17.0.3, Thunderbird ESR 17.x before 17.0.3, and SeaMonkey before 2.16 allow remote attackers to cause a denial of service (memory corruption and application crash) or possibly execute arbitrary code via unknown vectors.",2013-02-19,"http://www.debian.org/security/2013/dsa-2699,http://rhn.redhat.com/errata/RHSA-2013-0272.html,https://bugzilla.mozilla.org/show_bug.cgi?id=826471,https://bugzilla.mozilla.org/show_bug.cgi?id=830975,http://www.ubuntu.com/usn/USN-1748-1,https://bugzilla.mozilla.org/show_bug.cgi?id=780549,https://bugzilla.mozilla.org/show_bug.cgi?id=830399,https://bugzilla.mozilla.org/show_bug.cgi?id=812380,http://www.ubuntu.com/usn/USN-1729-1,https://bugzilla.mozilla.org/show_bug.cgi?id=690970,http://rhn.redhat.com/errata/RHSA-2013-0271.html,https://bugzilla.mozilla.org/show_bug.cgi?id=818241,https://bugzilla.mozilla.org/show_bug.cgi?id=822858,https://bugzilla.mozilla.org/show_bug.cgi?id=761448,http://lists.opensuse.org/opensuse-security-announce/2013-02/msg00017.html,http://www.ubuntu.com/usn/USN-1729-2,http://lists.opensuse.org/opensuse-updates/2013-02/msg00062.html,https://bugzilla.mozilla.org/show_bug.cgi?id=832162,http://www.mozilla.org/security/announce/2013/mfsa2013-21.html"
CVE-2013-0784,"Multiple unspecified vulnerabilities in the browser engine in Mozilla Firefox before 19.0, Thunderbird before 17.0.3, and SeaMonkey before 2.16 allow remote attackers to cause a denial of service (memory corruption and application crash) or possibly execute arbitrary code via unknown vectors.",2013-02-19,"https://bugzilla.mozilla.org/show_bug.cgi?id=766452,https://bugzilla.mozilla.org/show_bug.cgi?id=819635,http://www.ubuntu.com/usn/USN-1748-1,https://bugzilla.mozilla.org/show_bug.cgi?id=810169,https://bugzilla.mozilla.org/show_bug.cgi?id=790373,http://www.ubuntu.com/usn/USN-1729-1,https://bugzilla.mozilla.org/show_bug.cgi?id=799803,https://bugzilla.mozilla.org/show_bug.cgi?id=797977,https://bugzilla.mozilla.org/show_bug.cgi?id=805294,https://bugzilla.mozilla.org/show_bug.cgi?id=809295,https://bugzilla.mozilla.org/show_bug.cgi?id=827687,https://bugzilla.mozilla.org/show_bug.cgi?id=830943,http://lists.opensuse.org/opensuse-security-announce/2013-02/msg00017.html,http://www.ubuntu.com/usn/USN-1729-2,https://bugzilla.mozilla.org/show_bug.cgi?id=801114,http://lists.opensuse.org/opensuse-updates/2013-02/msg00062.html,https://bugzilla.mozilla.org/show_bug.cgi?id=799907,http://www.mozilla.org/security/announce/2013/mfsa2013-21.html"
CVE-2013-0787,"Use-after-free vulnerability in the nsEditor::IsPreformatted function in editor/libeditor/base/nsEditor.cpp in Mozilla Firefox before 19.0.2, Firefox ESR 17.x before 17.0.4, Thunderbird before 17.0.4, Thunderbird ESR 17.x before 17.0.4, and SeaMonkey before 2.16.1 allows remote attackers to execute arbitrary code via vectors involving an execCommand call.",2013-03-11,"http://www.debian.org/security/2013/dsa-2699,http://rhn.redhat.com/errata/RHSA-2013-0614.html,http://rhn.redhat.com/errata/RHSA-2013-0627.html,http://twitter.com/thezdi/statuses/309484730506698752,http://www.securityfocus.com/bid/58391,http://lists.opensuse.org/opensuse-security-announce/2013-03/msg00028.html,http://www.ubuntu.com/usn/USN-1758-1,https://bugzilla.mozilla.org/show_bug.cgi?id=848644,http://lists.opensuse.org/opensuse-security-announce/2013-03/msg00025.html,http://lists.opensuse.org/opensuse-security-announce/2013-03/msg00023.html,http://twitter.com/VUPEN/statuses/309505403631325184,http://lists.opensuse.org/opensuse-security-announce/2013-03/msg00026.html,http://www.mozilla.org/security/announce/2013/mfsa2013-29.html,http://h30499.www3.hp.com/t5/HP-Security-Research-Blog/Pwn2Own-2013/ba-p/5981157,http://lists.opensuse.org/opensuse-security-announce/2013-03/msg00010.html"
CVE-2013-0788,"Multiple unspecified vulnerabilities in the browser engine in Mozilla Firefox before 20.0, Firefox ESR 17.x before 17.0.5, Thunderbird before 17.0.5, Thunderbird ESR 17.x before 17.0.5, and SeaMonkey before 2.17 allow remote attackers to cause a denial of service (memory corruption and application crash) or possibly execute arbitrary code via unknown vectors.",2013-04-03,"http://www.debian.org/security/2013/dsa-2699,http://rhn.redhat.com/errata/RHSA-2013-0696.html,http://lists.opensuse.org/opensuse-security-announce/2013-05/msg00019.html,https://bugzilla.mozilla.org/show_bug.cgi?id=784730,http://lists.opensuse.org/opensuse-security-announce/2013-04/msg00013.html,http://rhn.redhat.com/errata/RHSA-2013-0697.html,http://lists.opensuse.org/opensuse-updates/2013-06/msg00012.html,http://www.mozilla.org/security/announce/2013/mfsa2013-30.html,https://bugzilla.mozilla.org/show_bug.cgi?id=840353,https://bugzilla.mozilla.org/show_bug.cgi?id=840263,http://lists.opensuse.org/opensuse-security-announce/2013-04/msg00010.html,https://bugzilla.mozilla.org/show_bug.cgi?id=635852,https://bugzilla.mozilla.org/show_bug.cgi?id=813442,https://bugzilla.mozilla.org/show_bug.cgi?id=771942,https://bugzilla.mozilla.org/show_bug.cgi?id=827870,https://bugzilla.mozilla.org/show_bug.cgi?id=852923,http://lists.opensuse.org/opensuse-security-announce/2013-04/msg00009.html,http://www.ubuntu.com/usn/USN-1791-1,https://bugzilla.mozilla.org/show_bug.cgi?id=839621,https://bugzilla.mozilla.org/show_bug.cgi?id=834240"
CVE-2013-0791,"The CERT_DecodeCertPackage function in Mozilla Network Security Services (NSS), as used in Mozilla Firefox before 20.0, Firefox ESR 17.x before 17.0.5, Thunderbird before 17.0.5, Thunderbird ESR 17.x before 17.0.5, SeaMonkey before 2.17, and other products, allows remote attackers to cause a denial of service (out-of-bounds read and memory corruption) via a crafted certificate.",2013-04-03,"http://rhn.redhat.com/errata/RHSA-2013-1144.html,http://lists.opensuse.org/opensuse-security-announce/2013-05/msg00019.html,https://bugzilla.mozilla.org/show_bug.cgi?id=629816,http://lists.opensuse.org/opensuse-security-announce/2013-04/msg00013.html,http://www.oracle.com/technetwork/topics/security/ovmbulletinjul2016-3090546.html,http://www.mozilla.org/security/announce/2013/mfsa2013-40.html,http://www.securityfocus.com/bid/58826,http://lists.opensuse.org/opensuse-security-announce/2013-04/msg00010.html,http://rhn.redhat.com/errata/RHSA-2013-1135.html,http://kb.juniper.net/InfoCenter/index?page=content&id=JSA10761,http://lists.opensuse.org/opensuse-security-announce/2013-04/msg00009.html,http://www.ubuntu.com/usn/USN-1791-1"
CVE-2013-0793,"Mozilla Firefox before 20.0, Firefox ESR 17.x before 17.0.5, Thunderbird before 17.0.5, Thunderbird ESR 17.x before 17.0.5, and SeaMonkey before 2.17 do not ensure the correctness of the address bar during history navigation, which allows remote attackers to conduct cross-site scripting (XSS) attacks or phishing attacks by leveraging control over navigation timing.",2013-04-03,"http://www.debian.org/security/2013/dsa-2699,http://rhn.redhat.com/errata/RHSA-2013-0696.html,http://lists.opensuse.org/opensuse-security-announce/2013-05/msg00019.html,http://www.mozilla.org/security/announce/2013/mfsa2013-38.html,https://bugzilla.mozilla.org/show_bug.cgi?id=803870,http://lists.opensuse.org/opensuse-security-announce/2013-04/msg00013.html,http://rhn.redhat.com/errata/RHSA-2013-0697.html,http://lists.opensuse.org/opensuse-updates/2013-06/msg00012.html,http://www.securityfocus.com/bid/58837,http://lists.opensuse.org/opensuse-security-announce/2013-04/msg00010.html,http://lists.opensuse.org/opensuse-security-announce/2013-04/msg00009.html,http://www.ubuntu.com/usn/USN-1791-1"
CVE-2013-0795,"The System Only Wrapper (SOW) implementation in Mozilla Firefox before 20.0, Firefox ESR 17.x before 17.0.5, Thunderbird before 17.0.5, Thunderbird ESR 17.x before 17.0.5, and SeaMonkey before 2.17 does not prevent use of the cloneNode method for cloning a protected node, which allows remote attackers to bypass the Same Origin Policy or possibly execute arbitrary JavaScript code with chrome privileges via a crafted web site.",2013-04-03,"http://www.debian.org/security/2013/dsa-2699,https://bugzilla.mozilla.org/show_bug.cgi?id=825697,http://rhn.redhat.com/errata/RHSA-2013-0696.html,http://lists.opensuse.org/opensuse-security-announce/2013-05/msg00019.html,http://lists.opensuse.org/opensuse-security-announce/2013-04/msg00013.html,http://rhn.redhat.com/errata/RHSA-2013-0697.html,http://lists.opensuse.org/opensuse-updates/2013-06/msg00012.html,http://www.mozilla.org/security/announce/2013/mfsa2013-36.html,http://lists.opensuse.org/opensuse-security-announce/2013-04/msg00010.html,http://lists.opensuse.org/opensuse-security-announce/2013-04/msg00009.html,http://www.ubuntu.com/usn/USN-1791-1"
CVE-2013-0796,"The WebGL subsystem in Mozilla Firefox before 20.0, Firefox ESR 17.x before 17.0.5, Thunderbird before 17.0.5, Thunderbird ESR 17.x before 17.0.5, and SeaMonkey before 2.17 on Linux does not properly interact with Mesa drivers, which allows remote attackers to execute arbitrary code or cause a denial of service (free of unallocated memory) via unspecified vectors.",2013-04-03,"http://www.debian.org/security/2013/dsa-2699,http://rhn.redhat.com/errata/RHSA-2013-0696.html,http://lists.opensuse.org/opensuse-security-announce/2013-05/msg00019.html,http://lists.opensuse.org/opensuse-security-announce/2013-04/msg00013.html,http://rhn.redhat.com/errata/RHSA-2013-0697.html,http://lists.opensuse.org/opensuse-updates/2013-06/msg00012.html,http://www.mozilla.org/security/announce/2013/mfsa2013-35.html,http://lists.opensuse.org/opensuse-security-announce/2013-04/msg00010.html,https://bugzilla.mozilla.org/show_bug.cgi?id=827106,https://bugzilla.mozilla.org/show_bug.cgi?id=838413,http://lists.opensuse.org/opensuse-security-announce/2013-04/msg00009.html,http://www.ubuntu.com/usn/USN-1791-1"
CVE-2013-0797,"Untrusted search path vulnerability in the Mozilla Updater in Mozilla Firefox before 20.0, Firefox ESR 17.x before 17.0.5, Thunderbird before 17.0.5, Thunderbird ESR 17.x before 17.0.5, and SeaMonkey before 2.17 allows local users to gain privileges via a Trojan horse DLL file in an unspecified directory.",2013-04-03,"http://www.mozilla.org/security/announce/2013/mfsa2013-34.html,https://bugzilla.mozilla.org/show_bug.cgi?id=830134,http://lists.opensuse.org/opensuse-security-announce/2013-05/msg00019.html,http://lists.opensuse.org/opensuse-security-announce/2013-04/msg00013.html"
CVE-2013-0799,"Buffer overflow in the Mozilla Maintenance Service in Mozilla Firefox before 20.0, Firefox ESR 17.x before 17.0.5, Thunderbird before 17.0.5, and Thunderbird ESR 17.x before 17.0.5 on Windows allows local users to gain privileges via crafted arguments.",2013-04-03,"http://lists.opensuse.org/opensuse-security-announce/2013-05/msg00019.html,https://bugzilla.mozilla.org/show_bug.cgi?id=848417,http://www.mozilla.org/security/announce/2013/mfsa2013-32.html,http://lists.opensuse.org/opensuse-security-announce/2013-04/msg00013.html"
CVE-2013-0800,"Integer signedness error in the pixman_fill_sse2 function in pixman-sse2.c in Pixman, as distributed with Cairo and used in Mozilla Firefox before 20.0, Firefox ESR 17.x before 17.0.5, Thunderbird before 17.0.5, Thunderbird ESR 17.x before 17.0.5, SeaMonkey before 2.17, and other products, allows remote attackers to execute arbitrary code via crafted values that trigger attempted use of a (1) negative box boundary or (2) negative box size, leading to an out-of-bounds write operation.",2013-04-03,"http://www.debian.org/security/2013/dsa-2699,http://rhn.redhat.com/errata/RHSA-2013-0696.html,http://lists.opensuse.org/opensuse-security-announce/2013-05/msg00019.html,http://www.mozilla.org/security/announce/2013/mfsa2013-31.html,http://lists.opensuse.org/opensuse-security-announce/2013-04/msg00013.html,http://rhn.redhat.com/errata/RHSA-2013-0697.html,http://lists.opensuse.org/opensuse-updates/2013-06/msg00012.html,http://lists.opensuse.org/opensuse-security-announce/2013-04/msg00010.html,http://lists.opensuse.org/opensuse-security-announce/2013-04/msg00009.html,http://www.ubuntu.com/usn/USN-1791-1,https://bugzilla.mozilla.org/show_bug.cgi?id=825721"
CVE-2013-0801,"Multiple unspecified vulnerabilities in the browser engine in Mozilla Firefox before 21.0, Firefox ESR 17.x before 17.0.6, Thunderbird before 17.0.6, and Thunderbird ESR 17.x before 17.0.6 allow remote attackers to cause a denial of service (memory corruption and application crash) or possibly execute arbitrary code via unknown vectors.",2013-05-16,"http://www.debian.org/security/2013/dsa-2699,http://lists.opensuse.org/opensuse-security-announce/2013-06/msg00006.html,https://bugzilla.mozilla.org/show_bug.cgi?id=787283,https://bugzilla.mozilla.org/show_bug.cgi?id=852315,http://www.mandriva.com/security/advisories?name=MDVSA-2013:165,http://www.securityfocus.com/bid/59855,http://www.ubuntu.com/usn/USN-1823-1,http://rhn.redhat.com/errata/RHSA-2013-0821.html,http://lists.opensuse.org/opensuse-security-announce/2013-05/msg00011.html,https://bugzilla.mozilla.org/show_bug.cgi?id=808402,http://rhn.redhat.com/errata/RHSA-2013-0820.html,https://bugzilla.mozilla.org/show_bug.cgi?id=864558,http://www.mozilla.org/security/announce/2013/mfsa2013-41.html,http://lists.opensuse.org/opensuse-security-announce/2013-05/msg00010.html,http://lists.opensuse.org/opensuse-security-announce/2013-05/msg00012.html,http://www.ubuntu.com/usn/USN-1822-1,http://lists.opensuse.org/opensuse-security-announce/2013-06/msg00008.html,https://bugzilla.mozilla.org/show_bug.cgi?id=866544,https://bugzilla.mozilla.org/show_bug.cgi?id=849597"
CVE-2013-1670,"The Chrome Object Wrapper (COW) implementation in Mozilla Firefox before 21.0, Firefox ESR 17.x before 17.0.6, Thunderbird before 17.0.6, and Thunderbird ESR 17.x before 17.0.6 does not prevent acquisition of chrome privileges during calls to content level constructors, which allows remote attackers to bypass certain read-only restrictions and conduct cross-site scripting (XSS) attacks via a crafted web site.",2013-05-16,"http://www.debian.org/security/2013/dsa-2699,http://www.mozilla.org/security/announce/2013/mfsa2013-42.html,http://lists.opensuse.org/opensuse-security-announce/2013-06/msg00006.html,https://bugzilla.mozilla.org/show_bug.cgi?id=853709,http://www.mandriva.com/security/advisories?name=MDVSA-2013:165,http://www.exploit-db.com/exploits/34363,http://www.ubuntu.com/usn/USN-1823-1,http://rhn.redhat.com/errata/RHSA-2013-0821.html,http://lists.opensuse.org/opensuse-security-announce/2013-05/msg00011.html,http://rhn.redhat.com/errata/RHSA-2013-0820.html,http://www.securityfocus.com/bid/59865,http://lists.opensuse.org/opensuse-security-announce/2013-05/msg00010.html,http://lists.opensuse.org/opensuse-security-announce/2013-05/msg00012.html,http://www.ubuntu.com/usn/USN-1822-1,http://www.osvdb.org/93427,http://lists.opensuse.org/opensuse-security-announce/2013-06/msg00008.html"
CVE-2013-1672,"The Mozilla Maintenance Service in Mozilla Firefox before 21.0, Firefox ESR 17.x before 17.0.6, Thunderbird before 17.0.6, and Thunderbird ESR 17.x before 17.0.6 on Windows allows local users to bypass integrity verification and gain privileges via vectors involving junctions.",2013-05-16,"http://www.mozilla.org/security/announce/2013/mfsa2013-44.html,https://bugzilla.mozilla.org/show_bug.cgi?id=850492"
CVE-2013-1674,"Use-after-free vulnerability in Mozilla Firefox before 21.0, Firefox ESR 17.x before 17.0.6, Thunderbird before 17.0.6, and Thunderbird ESR 17.x before 17.0.6 allows remote attackers to execute arbitrary code via vectors involving an onresize event during the playing of a video.",2013-05-16,"http://www.debian.org/security/2013/dsa-2699,http://lists.opensuse.org/opensuse-security-announce/2013-06/msg00006.html,http://www.securityfocus.com/bid/59859,http://www.mandriva.com/security/advisories?name=MDVSA-2013:165,https://bugzilla.mozilla.org/show_bug.cgi?id=860971,http://www.ubuntu.com/usn/USN-1823-1,http://rhn.redhat.com/errata/RHSA-2013-0821.html,http://lists.opensuse.org/opensuse-security-announce/2013-05/msg00011.html,http://rhn.redhat.com/errata/RHSA-2013-0820.html,http://www.mozilla.org/security/announce/2013/mfsa2013-46.html,http://lists.opensuse.org/opensuse-security-announce/2013-05/msg00010.html,http://lists.opensuse.org/opensuse-security-announce/2013-05/msg00012.html,http://www.ubuntu.com/usn/USN-1822-1,http://lists.opensuse.org/opensuse-security-announce/2013-06/msg00008.html"
CVE-2013-1675,"Mozilla Firefox before 21.0, Firefox ESR 17.x before 17.0.6, Thunderbird before 17.0.6, and Thunderbird ESR 17.x before 17.0.6 do not properly initialize data structures for the nsDOMSVGZoomEvent::mPreviousScale and nsDOMSVGZoomEvent::mNewScale functions, which allows remote attackers to obtain sensitive information from process memory via a crafted web site.",2013-05-16,"http://www.debian.org/security/2013/dsa-2699,http://www.mozilla.org/security/announce/2013/mfsa2013-47.html,http://lists.opensuse.org/opensuse-security-announce/2013-06/msg00006.html,http://www.mandriva.com/security/advisories?name=MDVSA-2013:165,http://www.ubuntu.com/usn/USN-1823-1,http://rhn.redhat.com/errata/RHSA-2013-0821.html,http://lists.opensuse.org/opensuse-security-announce/2013-05/msg00011.html,http://rhn.redhat.com/errata/RHSA-2013-0820.html,http://lists.opensuse.org/opensuse-security-announce/2013-05/msg00010.html,http://lists.opensuse.org/opensuse-security-announce/2013-05/msg00012.html,http://www.ubuntu.com/usn/USN-1822-1,https://bugzilla.mozilla.org/show_bug.cgi?id=866825,http://lists.opensuse.org/opensuse-security-announce/2013-06/msg00008.html,http://www.securityfocus.com/bid/59858"
