cve_id,description,published_date,references
CVE-2011-2372,"Mozilla Firefox before 3.6.23 and 4.x through 6, Thunderbird before 7.0, and SeaMonkey before 2.4 do not prevent the starting of a download in response to the holding of the Enter key, which allows user-assisted remote attackers to bypass intended access restrictions via a crafted web site.",2011-09-28,"http://www.mandriva.com/security/advisories?name=MDVSA-2011:142,http://www.debian.org/security/2011/dsa-2313,http://www.mandriva.com/security/advisories?name=MDVSA-2011:139,http://www.debian.org/security/2011/dsa-2317,https://bugzilla.mozilla.org/show_bug.cgi?id=657462,http://lists.opensuse.org/opensuse-updates/2011-10/msg00002.html,http://www.mandriva.com/security/advisories?name=MDVSA-2011:140,http://www.redhat.com/support/errata/RHSA-2011-1341.html,https://bugzilla.mozilla.org/show_bug.cgi?id=662309,http://www.mozilla.org/security/announce/2011/mfsa2011-40.html,https://bugzilla.mozilla.org/show_bug.cgi?id=663899,http://www.mandriva.com/security/advisories?name=MDVSA-2011:141,http://www.debian.org/security/2011/dsa-2312,http://lists.opensuse.org/opensuse-security-announce/2011-11/msg00020.html"
CVE-2011-2373,"Use-after-free vulnerability in Mozilla Firefox before 3.6.18 and 4.x through 4.0.1, Thunderbird before 3.1.11, and SeaMonkey through 2.0.14, when JavaScript is disabled, allows remote attackers to execute arbitrary code via a crafted XUL document.",2011-06-30,"http://support.avaya.com/css/P8/documents/100145333,https://exchange.xforce.ibmcloud.com/vulnerabilities/68133,http://lists.opensuse.org/opensuse-security-announce/2011-07/msg00001.html,https://bugzilla.mozilla.org/show_bug.cgi?id=617247,http://www.ubuntu.com/usn/USN-1149-1,http://www.debian.org/security/2011/dsa-2273,http://www.redhat.com/support/errata/RHSA-2011-0887.html,http://www.redhat.com/support/errata/RHSA-2011-0885.html,http://www.debian.org/security/2011/dsa-2268,http://www.redhat.com/support/errata/RHSA-2011-0888.html,http://support.avaya.com/css/P8/documents/100144854,http://www.mozilla.org/security/announce/2011/mfsa2011-20.html,http://www.debian.org/security/2011/dsa-2269,http://www.mandriva.com/security/advisories?name=MDVSA-2011:111"
CVE-2011-2374,"Multiple unspecified vulnerabilities in the browser engine in Mozilla Firefox before 3.6.18 and 4.x through 4.0.1, and Thunderbird before 3.1.11, allow remote attackers to cause a denial of service (memory corruption and application crash) or possibly execute arbitrary code via unknown vectors.",2011-06-30,"http://www.debian.org/security/2011/dsa-2268,http://www.debian.org/security/2011/dsa-2273,http://support.avaya.com/css/P8/documents/100144854,http://www.debian.org/security/2011/dsa-2269,http://www.mandriva.com/security/advisories?name=MDVSA-2011:111,http://www.redhat.com/support/errata/RHSA-2011-0886.html,http://support.avaya.com/css/P8/documents/100145333,http://lists.opensuse.org/opensuse-security-announce/2011-07/msg00001.html,http://www.redhat.com/support/errata/RHSA-2011-0887.html,https://exchange.xforce.ibmcloud.com/vulnerabilities/68128,https://bugzilla.mozilla.org/show_bug.cgi?id=645572,http://www.mozilla.org/security/announce/2011/mfsa2011-19.html,http://www.redhat.com/support/errata/RHSA-2011-0885.html,http://www.redhat.com/support/errata/RHSA-2011-0888.html,https://bugzilla.mozilla.org/show_bug.cgi?id=626262,https://bugzilla.mozilla.org/show_bug.cgi?id=643051,https://bugzilla.mozilla.org/show_bug.cgi?id=629858,http://www.ubuntu.com/usn/USN-1149-1,https://bugzilla.mozilla.org/show_bug.cgi?id=639648,https://bugzilla.mozilla.org/show_bug.cgi?id=642734,https://bugzilla.mozilla.org/show_bug.cgi?id=646662,https://bugzilla.mozilla.org/show_bug.cgi?id=642338"
CVE-2011-2375,Multiple unspecified vulnerabilities in the browser engine in Mozilla Firefox before 5.0 and Thunderbird through 3.1.11 allow remote attackers to cause a denial of service (memory corruption and application crash) or possibly execute arbitrary code via unknown vectors.,2011-06-30,"http://support.avaya.com/css/P8/documents/100145333,https://bugzilla.mozilla.org/show_bug.cgi?id=648705,https://bugzilla.mozilla.org/show_bug.cgi?id=653238,http://www.mozilla.org/security/announce/2011/mfsa2011-19.html,https://bugzilla.mozilla.org/show_bug.cgi?id=643839,https://bugzilla.mozilla.org/show_bug.cgi?id=652401,https://bugzilla.mozilla.org/show_bug.cgi?id=654015,http://www.redhat.com/support/errata/RHSA-2011-0887.html,http://www.redhat.com/support/errata/RHSA-2011-0885.html,https://bugzilla.mozilla.org/show_bug.cgi?id=597162,https://bugzilla.mozilla.org/show_bug.cgi?id=643927,http://www.redhat.com/support/errata/RHSA-2011-0888.html,https://bugzilla.mozilla.org/show_bug.cgi?id=648022,http://support.avaya.com/css/P8/documents/100144854,https://bugzilla.mozilla.org/show_bug.cgi?id=653026,http://www.mandriva.com/security/advisories?name=MDVSA-2011:111,http://www.redhat.com/support/errata/RHSA-2011-0886.html"
CVE-2011-2376,Multiple unspecified vulnerabilities in the browser engine in Mozilla Firefox before 3.6.18 and Thunderbird before 3.1.11 allow remote attackers to cause a denial of service (memory corruption and application crash) or possibly execute arbitrary code via unknown vectors.,2011-06-30,"http://support.avaya.com/css/P8/documents/100145333,http://www.mozilla.org/security/announce/2011/mfsa2011-19.html,http://lists.opensuse.org/opensuse-security-announce/2011-07/msg00001.html,http://www.ubuntu.com/usn/USN-1149-1,http://www.debian.org/security/2011/dsa-2273,http://www.redhat.com/support/errata/RHSA-2011-0887.html,http://www.redhat.com/support/errata/RHSA-2011-0885.html,http://www.debian.org/security/2011/dsa-2268,http://www.redhat.com/support/errata/RHSA-2011-0888.html,https://bugzilla.mozilla.org/show_bug.cgi?id=650874,http://support.avaya.com/css/P8/documents/100144854,https://bugzilla.mozilla.org/show_bug.cgi?id=635235,http://www.debian.org/security/2011/dsa-2269,http://www.mandriva.com/security/advisories?name=MDVSA-2011:111,http://www.redhat.com/support/errata/RHSA-2011-0886.html"
CVE-2011-2377,"Mozilla Firefox before 3.6.18 and 4.x through 4.0.1, Thunderbird before 3.1.11, and SeaMonkey through 2.0.14 allow remote attackers to cause a denial of service (memory corruption and application crash) or possibly execute arbitrary code via a multipart/x-mixed-replace image.",2011-06-30,"http://support.avaya.com/css/P8/documents/100145333,http://lists.opensuse.org/opensuse-security-announce/2011-07/msg00001.html,https://bugzilla.mozilla.org/show_bug.cgi?id=638018,http://www.ubuntu.com/usn/USN-1149-1,http://www.mozilla.org/security/announce/2011/mfsa2011-21.html,https://bugzilla.mozilla.org/show_bug.cgi?id=639303,http://www.redhat.com/support/errata/RHSA-2011-0887.html,http://www.redhat.com/support/errata/RHSA-2011-0885.html,http://www.redhat.com/support/errata/RHSA-2011-0888.html,http://support.avaya.com/css/P8/documents/100144854,http://www.mandriva.com/security/advisories?name=MDVSA-2011:111,http://www.redhat.com/support/errata/RHSA-2011-0886.html"
CVE-2011-2378,"The appendChild function in Mozilla Firefox before 3.6.20, Thunderbird 3.x before 3.1.12, SeaMonkey 2.x, and possibly other products does not properly handle DOM objects, which allows remote attackers to execute arbitrary code via unspecified vectors that lead to dereferencing of a ""dangling pointer.""",2011-08-18,"http://lists.opensuse.org/opensuse-security-announce/2011-08/msg00027.html,http://www.redhat.com/support/errata/RHSA-2011-1164.html,http://www.mandriva.com/security/advisories?name=MDVSA-2011:127,http://lists.opensuse.org/opensuse-security-announce/2011-08/msg00023.html,http://www.mozilla.org/security/announce/2011/mfsa2011-30.html,http://www.redhat.com/support/errata/RHSA-2011-1166.html,https://bugzilla.mozilla.org/show_bug.cgi?id=648065,http://www.debian.org/security/2011/dsa-2296,http://www.debian.org/security/2011/dsa-2295,http://www.debian.org/security/2011/dsa-2297"
CVE-2011-2605,"CRLF injection vulnerability in the nsCookieService::SetCookieStringInternal function in netwerk/cookie/nsCookieService.cpp in Mozilla Firefox before 3.6.18 and 4.x through 4.0.1, and Thunderbird before 3.1.11, allows remote attackers to bypass intended access restrictions via a string containing a \n (newline) character, which is not properly handled in a JavaScript ""document.cookie ="" expression, a different vulnerability than CVE-2011-2374.",2011-06-30,"https://bugzilla.mozilla.org/show_bug.cgi?id=643051,http://www.mozilla.org/security/announce/2011/mfsa2011-19.html,http://www.redhat.com/support/errata/RHSA-2011-0887.html,http://www.redhat.com/support/errata/RHSA-2011-0885.html,http://www.redhat.com/support/errata/RHSA-2011-0888.html,http://www.redhat.com/support/errata/RHSA-2011-0886.html"
CVE-2011-2980,"Untrusted search path vulnerability in the ThinkPadSensor::Startup function in Mozilla Firefox before 3.6.20, Thunderbird 3.x before 3.1.12, allows local users to gain privileges by leveraging write access in an unspecified directory to place a Trojan horse DLL that is loaded into the running Firefox process.",2011-08-18,"http://lists.opensuse.org/opensuse-security-announce/2011-08/msg00027.html,http://www.mandriva.com/security/advisories?name=MDVSA-2011:127,http://lists.opensuse.org/opensuse-security-announce/2011-08/msg00023.html,http://www.mozilla.org/security/announce/2011/mfsa2011-30.html,https://bugzilla.mozilla.org/show_bug.cgi?id=642469"
CVE-2011-2981,"The event-management implementation in Mozilla Firefox before 3.6.20, SeaMonkey 2.x, Thunderbird 3.x before 3.1.12, and possibly other products does not properly select the context for script to run in, which allows remote attackers to bypass the Same Origin Policy or execute arbitrary JavaScript code with chrome privileges via a crafted web site.",2011-08-18,"http://lists.opensuse.org/opensuse-security-announce/2011-08/msg00027.html,https://bugzilla.mozilla.org/show_bug.cgi?id=643450,http://www.redhat.com/support/errata/RHSA-2011-1164.html,http://www.mandriva.com/security/advisories?name=MDVSA-2011:127,http://lists.opensuse.org/opensuse-security-announce/2011-08/msg00023.html,https://bugzilla.mozilla.org/show_bug.cgi?id=650252,http://www.mozilla.org/security/announce/2011/mfsa2011-30.html,http://www.debian.org/security/2011/dsa-2296,http://www.debian.org/security/2011/dsa-2295,http://www.debian.org/security/2011/dsa-2297,https://bugzilla.mozilla.org/show_bug.cgi?id=614151"
CVE-2011-2982,"Multiple unspecified vulnerabilities in the browser engine in Mozilla Firefox before 3.6.20, Thunderbird 2.x and 3.x before 3.1.12, SeaMonkey 1.x and 2.x, and possibly other products allow remote attackers to cause a denial of service (memory corruption and application crash) or possibly execute arbitrary code via unknown vectors.",2011-08-18,"http://lists.opensuse.org/opensuse-security-announce/2011-08/msg00027.html,http://www.securitytracker.com/id?1025940,http://www.redhat.com/support/errata/RHSA-2011-1164.html,https://bugzilla.mozilla.org/show_bug.cgi?id=615970,https://bugzilla.mozilla.org/show_bug.cgi?id=632206,http://www.mandriva.com/security/advisories?name=MDVSA-2011:127,http://lists.opensuse.org/opensuse-security-announce/2011-08/msg00023.html,http://www.redhat.com/support/errata/RHSA-2011-1167.html,https://bugzilla.mozilla.org/show_bug.cgi?id=643062,http://www.mozilla.org/security/announce/2011/mfsa2011-30.html,https://bugzilla.mozilla.org/show_bug.cgi?id=541255,http://www.redhat.com/support/errata/RHSA-2011-1166.html,http://www.redhat.com/support/errata/RHSA-2011-1165.html,http://www.debian.org/security/2011/dsa-2296,http://www.debian.org/security/2011/dsa-2295,http://www.debian.org/security/2011/dsa-2297,https://bugzilla.mozilla.org/show_bug.cgi?id=674545"
CVE-2011-2983,"Mozilla Firefox before 3.6.20, Thunderbird 2.x and 3.x before 3.1.12, SeaMonkey 1.x and 2.x, and possibly other products does not properly handle the RegExp.input property, which allows remote attackers to bypass the Same Origin Policy and read data from a different domain via a crafted web site, possibly related to a use-after-free.",2011-08-18,"http://lists.opensuse.org/opensuse-security-announce/2011-08/msg00027.html,http://www.securitytracker.com/id?1025940,http://www.redhat.com/support/errata/RHSA-2011-1164.html,http://www.mandriva.com/security/advisories?name=MDVSA-2011:127,http://lists.opensuse.org/opensuse-security-announce/2011-08/msg00023.html,http://www.redhat.com/support/errata/RHSA-2011-1167.html,https://bugzilla.mozilla.org/show_bug.cgi?id=626297,http://www.mozilla.org/security/announce/2011/mfsa2011-30.html,http://www.redhat.com/support/errata/RHSA-2011-1165.html,http://www.debian.org/security/2011/dsa-2296,http://www.debian.org/security/2011/dsa-2295,http://www.debian.org/security/2011/dsa-2297"
CVE-2011-2984,"Mozilla Firefox before 3.6.20, SeaMonkey 2.x, Thunderbird 3.x before 3.1.12, and possibly other products does not properly handle the dropping of a tab element, which allows remote attackers to execute arbitrary JavaScript code with chrome privileges by establishing a content area and registering for drop events.",2011-08-18,"http://lists.opensuse.org/opensuse-security-announce/2011-08/msg00027.html,http://www.redhat.com/support/errata/RHSA-2011-1164.html,http://www.mandriva.com/security/advisories?name=MDVSA-2011:127,http://lists.opensuse.org/opensuse-security-announce/2011-08/msg00023.html,http://www.mozilla.org/security/announce/2011/mfsa2011-30.html,http://www.debian.org/security/2011/dsa-2296,http://www.debian.org/security/2011/dsa-2295,http://www.debian.org/security/2011/dsa-2297,https://bugzilla.mozilla.org/show_bug.cgi?id=572129"
CVE-2011-2985,"Multiple unspecified vulnerabilities in the browser engine in Mozilla Firefox 4.x through 5, Thunderbird before 6, SeaMonkey 2.x before 2.3, and possibly other products allow remote attackers to cause a denial of service (memory corruption and application crash) or possibly execute arbitrary code via unknown vectors.",2011-08-18,"http://www.mozilla.org/security/announce/2011/mfsa2011-29.html,https://bugzilla.mozilla.org/show_bug.cgi?id=668245,https://bugzilla.mozilla.org/show_bug.cgi?id=650732,https://bugzilla.mozilla.org/show_bug.cgi?id=662132,http://lists.opensuse.org/opensuse-security-announce/2011-08/msg00023.html,https://bugzilla.mozilla.org/show_bug.cgi?id=667512,https://bugzilla.mozilla.org/show_bug.cgi?id=667092,https://bugzilla.mozilla.org/show_bug.cgi?id=667315,https://bugzilla.mozilla.org/show_bug.cgi?id=660517,https://bugzilla.mozilla.org/show_bug.cgi?id=669584,https://bugzilla.mozilla.org/show_bug.cgi?id=650273,https://bugzilla.mozilla.org/show_bug.cgi?id=665518,https://bugzilla.mozilla.org/show_bug.cgi?id=646825,http://www.mozilla.org/security/announce/2011/mfsa2011-31.html,https://bugzilla.mozilla.org/show_bug.cgi?id=650275,https://bugzilla.mozilla.org/show_bug.cgi?id=651030,https://bugzilla.mozilla.org/show_bug.cgi?id=648206,http://www.mozilla.org/security/announce/2011/mfsa2011-33.html"
CVE-2011-2986,"Mozilla Firefox 4.x through 5, Thunderbird before 6, SeaMonkey 2.x before 2.3, and possibly other products, when the Direct2D (aka D2D) API is used on Windows, allows remote attackers to bypass the Same Origin Policy, and obtain sensitive image data from a different domain, by inserting this data into a canvas.",2011-08-18,"http://www.mozilla.org/security/announce/2011/mfsa2011-29.html,http://lists.opensuse.org/opensuse-security-announce/2011-08/msg00023.html,https://bugzilla.mozilla.org/show_bug.cgi?id=655836,http://www.mozilla.org/security/announce/2011/mfsa2011-31.html,http://www.mozilla.org/security/announce/2011/mfsa2011-33.html"
CVE-2011-2987,"Heap-based buffer overflow in Almost Native Graphics Layer Engine (ANGLE), as used in the WebGL implementation in Mozilla Firefox 4.x through 5, Thunderbird before 6, SeaMonkey 2.x before 2.3, and possibly other products might allow remote attackers to execute arbitrary code via unspecified vectors.",2011-08-18,"http://www.mozilla.org/security/announce/2011/mfsa2011-29.html,http://lists.opensuse.org/opensuse-security-announce/2011-08/msg00023.html,http://www.securityfocus.com/bid/49226,http://www.mozilla.org/security/announce/2011/mfsa2011-31.html,https://bugzilla.mozilla.org/show_bug.cgi?id=665934,http://www.mozilla.org/security/announce/2011/mfsa2011-33.html"
CVE-2011-2988,"Buffer overflow in an unspecified string class in the WebGL shader implementation in Mozilla Firefox 4.x through 5, Thunderbird before 6, SeaMonkey 2.x before 2.3, and possibly other products allows remote attackers to execute arbitrary code or cause a denial of service (application crash) via a long source-code block for a shader.",2011-08-18,"http://www.mozilla.org/security/announce/2011/mfsa2011-29.html,http://lists.opensuse.org/opensuse-security-announce/2011-08/msg00023.html,http://www.mozilla.org/security/announce/2011/mfsa2011-31.html,https://bugzilla.mozilla.org/show_bug.cgi?id=665936,http://www.securityfocus.com/bid/49242,http://www.mozilla.org/security/announce/2011/mfsa2011-33.html"
CVE-2011-2989,"The browser engine in Mozilla Firefox 4.x through 5, SeaMonkey 2.x before 2.3, Thunderbird before 6, and possibly other products does not properly implement WebGL, which allows remote attackers to cause a denial of service (memory corruption and application crash) or possibly execute arbitrary code via unspecified vectors.",2011-08-18,"http://www.mozilla.org/security/announce/2011/mfsa2011-29.html,http://lists.opensuse.org/opensuse-security-announce/2011-08/msg00023.html,https://bugzilla.mozilla.org/show_bug.cgi?id=674042,http://www.mozilla.org/security/announce/2011/mfsa2011-31.html,http://www.mozilla.org/security/announce/2011/mfsa2011-33.html"
CVE-2011-2991,"The browser engine in Mozilla Firefox 4.x through 5, SeaMonkey 2.x before 2.3, Thunderbird before 6, and possibly other products does not properly implement JavaScript, which allows remote attackers to cause a denial of service (memory corruption and application crash) or possibly execute arbitrary code via unspecified vectors.",2011-08-18,"http://www.mozilla.org/security/announce/2011/mfsa2011-29.html,http://lists.opensuse.org/opensuse-security-announce/2011-08/msg00023.html,https://bugzilla.mozilla.org/show_bug.cgi?id=655660,http://www.mozilla.org/security/announce/2011/mfsa2011-31.html,http://www.mozilla.org/security/announce/2011/mfsa2011-33.html"
CVE-2011-2992,"The Ogg reader in the browser engine in Mozilla Firefox 4.x through 5, SeaMonkey 2.x before 2.3, Thunderbird before 6, and possibly other products allows remote attackers to cause a denial of service (memory corruption and application crash) or possibly execute arbitrary code via unspecified vectors.",2011-08-18,"http://www.mozilla.org/security/announce/2011/mfsa2011-29.html,https://bugzilla.mozilla.org/show_bug.cgi?id=672789,http://lists.opensuse.org/opensuse-security-announce/2011-08/msg00023.html,http://www.mozilla.org/security/announce/2011/mfsa2011-31.html,http://www.mozilla.org/security/announce/2011/mfsa2011-33.html"
CVE-2011-2995,"Multiple unspecified vulnerabilities in the browser engine in Mozilla Firefox before 3.6.23 and 4.x through 6, Thunderbird before 7.0, and SeaMonkey before 2.4 allow remote attackers to cause a denial of service (memory corruption and application crash) or possibly execute arbitrary code via unknown vectors.",2011-09-28,"http://www.mandriva.com/security/advisories?name=MDVSA-2011:142,http://www.debian.org/security/2011/dsa-2313,http://www.mandriva.com/security/advisories?name=MDVSA-2011:139,http://www.debian.org/security/2011/dsa-2317,http://lists.opensuse.org/opensuse-updates/2011-10/msg00002.html,http://www.mandriva.com/security/advisories?name=MDVSA-2011:140,http://www.redhat.com/support/errata/RHSA-2011-1341.html,https://bugzilla.mozilla.org/show_bug.cgi?id=655098,http://www.mozilla.org/security/announce/2011/mfsa2011-36.html,https://bugzilla.mozilla.org/show_bug.cgi?id=660453,https://bugzilla.mozilla.org/show_bug.cgi?id=662215,https://bugzilla.mozilla.org/show_bug.cgi?id=665360,http://www.mandriva.com/security/advisories?name=MDVSA-2011:141,http://www.debian.org/security/2011/dsa-2312"
CVE-2011-2997,"Multiple unspecified vulnerabilities in the browser engine in Mozilla Firefox 6, Thunderbird before 7.0, and SeaMonkey before 2.4 allow remote attackers to cause a denial of service (memory corruption and application crash) or possibly execute arbitrary code via unknown vectors.",2011-09-28,"http://www.mandriva.com/security/advisories?name=MDVSA-2011:142,https://bugzilla.mozilla.org/show_bug.cgi?id=661567,https://bugzilla.mozilla.org/show_bug.cgi?id=673757,https://bugzilla.mozilla.org/show_bug.cgi?id=667011,http://lists.opensuse.org/opensuse-updates/2011-10/msg00002.html,https://bugzilla.mozilla.org/show_bug.cgi?id=667507,https://bugzilla.mozilla.org/show_bug.cgi?id=657198,https://bugzilla.mozilla.org/show_bug.cgi?id=658864,http://www.mozilla.org/security/announce/2011/mfsa2011-36.html,https://bugzilla.mozilla.org/show_bug.cgi?id=671756,https://bugzilla.mozilla.org/show_bug.cgi?id=669228,https://bugzilla.mozilla.org/show_bug.cgi?id=670319,https://bugzilla.mozilla.org/show_bug.cgi?id=552002,https://bugzilla.mozilla.org/show_bug.cgi?id=678818,https://bugzilla.mozilla.org/show_bug.cgi?id=664930,http://www.mandriva.com/security/advisories?name=MDVSA-2011:141,https://bugzilla.mozilla.org/show_bug.cgi?id=672436,https://bugzilla.mozilla.org/show_bug.cgi?id=668941"
CVE-2011-2999,"Mozilla Firefox before 3.6.23 and 4.x through 5, Thunderbird before 6.0, and SeaMonkey before 2.3 do not properly handle ""location"" as the name of a frame, which allows remote attackers to bypass the Same Origin Policy via a crafted web site, a different vulnerability than CVE-2010-0170.",2011-09-28,"http://www.debian.org/security/2011/dsa-2313,http://www.mandriva.com/security/advisories?name=MDVSA-2011:139,http://www.debian.org/security/2011/dsa-2317,http://lists.opensuse.org/opensuse-updates/2011-10/msg00002.html,http://www.mandriva.com/security/advisories?name=MDVSA-2011:140,http://www.redhat.com/support/errata/RHSA-2011-1341.html,http://www.mozilla.org/security/announce/2011/mfsa2011-38.html,https://bugzilla.mozilla.org/show_bug.cgi?id=665548,http://www.mandriva.com/security/advisories?name=MDVSA-2011:141,http://www.debian.org/security/2011/dsa-2312,http://lists.opensuse.org/opensuse-security-announce/2011-11/msg00020.html"
CVE-2011-3000,"Mozilla Firefox before 3.6.23 and 4.x through 6, Thunderbird before 7.0, and SeaMonkey before 2.4 do not properly handle HTTP responses that contain multiple Location, Content-Length, or Content-Disposition headers, which makes it easier for remote attackers to conduct HTTP response splitting attacks via crafted header values.",2011-09-28,"http://www.mandriva.com/security/advisories?name=MDVSA-2011:142,http://www.debian.org/security/2011/dsa-2313,http://www.mandriva.com/security/advisories?name=MDVSA-2011:139,http://www.debian.org/security/2011/dsa-2317,http://lists.opensuse.org/opensuse-updates/2011-10/msg00002.html,http://www.mandriva.com/security/advisories?name=MDVSA-2011:140,http://www.redhat.com/support/errata/RHSA-2011-1341.html,https://bugzilla.mozilla.org/show_bug.cgi?id=655389,http://www.mandriva.com/security/advisories?name=MDVSA-2011:141,http://www.debian.org/security/2011/dsa-2312,http://lists.opensuse.org/opensuse-security-announce/2011-11/msg00020.html,http://www.mozilla.org/security/announce/2011/mfsa2011-39.html"
CVE-2011-3001,"Mozilla Firefox 4.x through 6, Thunderbird before 7.0, and SeaMonkey before 2.4 do not prevent manual add-on installation in response to the holding of the Enter key, which allows user-assisted remote attackers to bypass intended access restrictions via a crafted web site that triggers an unspecified internal error.",2011-09-28,"http://www.mandriva.com/security/advisories?name=MDVSA-2011:142,http://www.mandriva.com/security/advisories?name=MDVSA-2011:139,http://lists.opensuse.org/opensuse-updates/2011-10/msg00002.html,http://www.mandriva.com/security/advisories?name=MDVSA-2011:140,https://bugzilla.mozilla.org/show_bug.cgi?id=672485,http://www.mozilla.org/security/announce/2011/mfsa2011-40.html,http://www.mandriva.com/security/advisories?name=MDVSA-2011:141,http://lists.opensuse.org/opensuse-security-announce/2011-11/msg00020.html"
CVE-2011-3005,"Use-after-free vulnerability in Mozilla Firefox 4.x through 6, Thunderbird before 7.0, and SeaMonkey before 2.4 allows remote attackers to cause a denial of service (application crash) or possibly execute arbitrary code via crafted OGG headers in a .ogg file.",2011-09-28,"http://www.mandriva.com/security/advisories?name=MDVSA-2011:142,https://bugzilla.mozilla.org/show_bug.cgi?id=675747,http://lists.opensuse.org/opensuse-updates/2011-10/msg00002.html,http://www.mandriva.com/security/advisories?name=MDVSA-2011:141,http://www.mozilla.org/security/announce/2011/mfsa2011-44.html"
CVE-2011-3232,"YARR, as used in Mozilla Firefox before 7.0, Thunderbird before 7.0, and SeaMonkey before 2.4, allows remote attackers to cause a denial of service (application crash) or possibly execute arbitrary code via crafted JavaScript.",2011-09-28,"http://www.mandriva.com/security/advisories?name=MDVSA-2011:142,http://support.apple.com/kb/HT4981,http://www.mozilla.org/security/announce/2011/mfsa2011-42.html,https://bugs.webkit.org/show_bug.cgi?id=61585,http://lists.apple.com/archives/Security-announce/2011//Oct/msg00004.html,http://lists.opensuse.org/opensuse-updates/2011-10/msg00002.html,http://support.apple.com/kb/HT4999,http://lists.apple.com/archives/Security-announce/2011//Oct/msg00002.html,https://bugzilla.mozilla.org/show_bug.cgi?id=653672,http://support.apple.com/kb/HT5001,http://lists.apple.com/archives/Security-announce/2011//Oct/msg00001.html,http://support.apple.com/kb/HT5000,http://lists.apple.com/archives/Security-announce/2011//Oct/msg00000.html,http://www.mandriva.com/security/advisories?name=MDVSA-2011:141"
